{
  "$schema": "https://json-schema.org/draft/2020-12/schema",
  "$id": "https://github.com/Jstar269/nakagawa-recomp/raw/main/assets/title_manifest.schema.json",
  "title": "Nakagawa Recomp Public Title Manifest v1",
  "description": "Source-owned title configuration. Private paths, hashes, keys, analysis products, and game-derived evidence are intentionally out of scope.",
  "type": "object",
  "additionalProperties": false,
  "required": [
    "schema_version",
    "id",
    "display_name",
    "kind",
    "executable",
    "modules",
    "filesystem",
    "hle_profile",
    "feature_requirements",
    "verification_profile"
  ],
  "properties": {
    "schema_version": {"const": 1},
    "id": {
      "type": "string",
      "pattern": "^[a-z0-9][a-z0-9._-]{0,63}$"
    },
    "display_name": {
      "type": "string",
      "minLength": 1,
      "maxLength": 128
    },
    "kind": {
      "enum": ["retail", "homebrew", "synthetic"]
    },
    "disc": {
      "$ref": "#/$defs/disc"
    },
    "executable": {
      "$ref": "#/$defs/executable"
    },
    "modules": {
      "type": "array",
      "maxItems": 256,
      "items": {"$ref": "#/$defs/module"}
    },
    "filesystem": {
      "$ref": "#/$defs/filesystem"
    },
    "game_name": {
      "type": "string",
      "pattern": "^[a-z0-9][a-z0-9._-]{0,63}$"
    },
    "hle_profile": {
      "$ref": "#/$defs/identifier"
    },
    "codegen_profile": {
      "enum": ["none", "hst"]
    },
    "feature_requirements": {
      "type": "array",
      "maxItems": 64,
      "uniqueItems": true,
      "items": {"$ref": "#/$defs/identifier"}
    },
    "compatibility_manifest": {
      "$ref": "#/$defs/relativePath"
    },
    "verification_profile": {
      "$ref": "#/$defs/identifier"
    },
    "runtime_contract": {
      "$ref": "#/$defs/runtimeContract"
    },
    "profile_zero": {
      "$ref": "#/$defs/profileZero"
    },
    "runtime_bindings": {
      "$ref": "#/$defs/runtimeBindings"
    },
    "required_runtime_bindings": {
      "type": "array",
      "maxItems": 6,
      "uniqueItems": true,
      "items": {
        "enum": [
          "callback_terminators",
          "dispatch_aliases",
          "expected_data_file_count",
          "fallback_entry",
          "launcher_thread_entry",
          "worker_thread_entry"
        ]
      }
    },
    "notes": {
      "type": "string",
      "maxLength": 2048
    }
  },
  "allOf": [
    {
      "if": {"properties": {"kind": {"const": "retail"}}, "required": ["kind"]},
      "then": {"required": ["disc"]},
      "else": {"not": {"required": ["disc"]}}
    },
    {
      "if": {"required": ["profile_zero"]},
      "then": {
        "required": ["kind", "runtime_contract"],
        "properties": {
          "kind": {"const": "synthetic"},
          "runtime_contract": {
            "type": "object",
            "required": ["profile_id"],
            "properties": {"profile_id": {"const": "profile-zero-v1"}}
          }
        }
      }
    }
  ],
  "$defs": {
    "identifier": {
      "type": "string",
      "pattern": "^[a-z0-9][a-z0-9._-]{0,63}$"
    },
    "uint32": {
      "type": "integer",
      "minimum": 0,
      "maximum": 4294967295
    },
    "relativePath": {
      "type": "string",
      "minLength": 1,
      "maxLength": 240,
      "pattern": "^(?!/)(?!.*(?:^|/)\\.\\.(?:/|$))(?!.*\\\\)(?!.*:)[A-Za-z0-9._-]+(?:/[A-Za-z0-9._-]+)*$"
    },
    "discImagePath": {
      "description": "Relative disc-image path. Only the runtime consumes it (never Make), so file names may contain spaces and Unicode; Windows-forbidden and control characters, empty/'.'/'..' components, a leading space and a trailing space or dot are rejected.",
      "type": "string",
      "minLength": 1,
      "maxLength": 240,
      "pattern": "^(?!/)(?!.*//)(?!.*/$)(?!(?:.*/)?\\.\\.?(?:/|$))(?!(?:.*/)? )(?!.*[ .](?:/|$))[^<>:\"\\\\|?*\\u0000-\\u001f\\u007f]+$"
    },
    "disc": {
      "type": "object",
      "additionalProperties": false,
      "required": ["id", "region", "revision_policy"],
      "properties": {
        "id": {
          "type": "string",
          "pattern": "^[A-Z]{4}[0-9]{5}$"
        },
        "region": {
          "enum": ["JP", "NA", "EU", "KR", "ASIA", "OTHER"]
        },
        "revision_policy": {
          "enum": ["exact-disc-id", "explicit-compatible-revisions"]
        },
        "compatible_revisions": {
          "type": "array",
          "minItems": 1,
          "maxItems": 16,
          "uniqueItems": true,
          "items": {
            "type": "string",
            "pattern": "^[A-Z]{4}[0-9]{5}$"
          }
        },
        "require_local_compatibility_record": {
          "description": "Require an exact user-local title input identity record before this revision can build or launch.",
          "type": "boolean"
        }
      },
      "allOf": [
        {
          "if": {
            "properties": {"revision_policy": {"const": "exact-disc-id"}},
            "required": ["revision_policy"]
          },
          "then": {"not": {"required": ["compatible_revisions"]}},
          "else": {"required": ["compatible_revisions"]}
        }
      ]
    },
    "span": {
      "type": "object",
      "additionalProperties": false,
      "required": ["start", "end"],
      "properties": {
        "start": {"$ref": "#/$defs/uint32"},
        "end": {
          "type": "integer",
          "minimum": 0,
          "maximum": 4294967296
        }
      }
    },
    "executable": {
      "type": "object",
      "additionalProperties": false,
      "dependentRequired": {
        "load_address": ["load_address_evidence"],
        "load_address_evidence": ["load_address"]
      },
      "required": ["base", "entry", "bss_metadata_source", "extra_executable_spans"],
      "properties": {
        "base": {"$ref": "#/$defs/uint32"},
        "entry": {"$ref": "#/$defs/uint32"},
        "load_address": {"$ref": "#/$defs/uint32"},
        "load_address_evidence": {
          "enum": ["measured-hw", "measured-ppsspp", "provisional", "documented-psp-default"]
        },
        "bss_metadata_source": {
          "enum": ["elf", "psp-header", "none"]
        },
        "extra_executable_spans": {
          "type": "array",
          "maxItems": 64,
          "items": {"$ref": "#/$defs/span"}
        }
      }
    },
    "module": {
      "type": "object",
      "additionalProperties": false,
      "required": ["name", "required", "role"],
      "if": {"properties": {"placement": {"const": "runtime"}}, "required": ["placement"]},
      "then": {
        "properties": {"role": {"enum": ["guest-prx", "optional-guest-prx"]}},
        "not": {"anyOf": [{"required": ["load_address"]}, {"required": ["load_address_evidence"]}]}
      },
      "else": {"required": ["load_address"]},
      "properties": {
        "placement": {
          "description": "fixed (default): translated and loaded at load_address. runtime: no address; translated position-independently and laid out by the guest allocator when the game loads it.",
          "enum": ["fixed", "runtime"]
        },
        "name": {
          "type": "string",
          "pattern": "^[A-Za-z0-9][A-Za-z0-9._-]{0,127}$"
        },
        "load_address": {"$ref": "#/$defs/uint32"},
        "required": {"type": "boolean"},
        "role": {
          "enum": ["guest-prx", "hle-capability", "optional-guest-prx"]
        },
        "guest_path": {
          "type": "string",
          "maxLength": 256,
          "pattern": "^(disc0|umd0|ms0|flash0|host0):/"
        },
        "load_address_evidence": {
          "enum": ["measured-hw", "measured-ppsspp", "provisional"]
        }
      }
    },
    "filesystem": {
      "type": "object",
      "additionalProperties": false,
      "required": ["data_root", "memory_stick_root", "device_prefixes"],
      "properties": {
        "data_root": {
          "description": "Portable relative directory required by the title, or an empty string when the title has no separate data directory.",
          "oneOf": [
            {"const": ""},
            {"$ref": "#/$defs/relativePath"}
          ]
        },
        "executable": {"$ref": "#/$defs/relativePath"},
        "module_dir": {"$ref": "#/$defs/relativePath"},
        "psp_header": {"$ref": "#/$defs/relativePath"},
        "disc_image": {"$ref": "#/$defs/discImagePath"},
        "memory_stick_root": {"$ref": "#/$defs/relativePath"},
        "loose_content_roots": {
          "type": "array",
          "maxItems": 16,
          "items": {"$ref": "#/$defs/looseContentRoot"}
        },
        "device_prefixes": {
          "type": "array",
          "maxItems": 16,
          "uniqueItems": true,
          "items": {
            "type": "string",
            "pattern": "^[A-Za-z][A-Za-z0-9]{0,15}:$"
          }
        }
      }
    },
    "looseContentRoot": {
      "type": "object",
      "additionalProperties": false,
      "required": ["root", "mount", "precedence"],
      "properties": {
        "root": {
          "oneOf": [
            {"const": "."},
            {"$ref": "#/$defs/relativePath"}
          ]
        },
        "mount": {
          "anyOf": [
            {"const": ""},
            {"$ref": "#/$defs/relativePath"}
          ]
        },
        "precedence": {"type": "integer", "minimum": 0, "maximum": 65535},
        "skip_primary_root": {"type": "boolean"},
        "exclude": {
          "type": "array",
          "maxItems": 2,
          "uniqueItems": true,
          "items": {"$ref": "#/$defs/relativePath"}
        }
      },
      "allOf": [
        {
          "if": {"properties": {"root": {"const": "."}}, "required": ["root"]},
          "then": {"properties": {"skip_primary_root": {"const": true}}},
          "else": {"properties": {"skip_primary_root": {"const": false}}}
        }
      ]
    },
    "runtimeContract": {
      "type": "object",
      "additionalProperties": false,
      "required": [
        "schema_version", "core_contract", "profile_id", "capability_requirements",
        "unknown_capability_policy", "boot", "resources", "hle_overrides",
        "input_mapping", "enhancements", "evidence_profile"
      ],
      "properties": {
        "schema_version": {"const": 1},
        "core_contract": {"const": "psp-core-v1"},
        "profile_id": {"$ref": "#/$defs/identifier"},
        "capability_requirements": {
          "type": "array", "maxItems": 32, "uniqueItems": true,
          "items": {"enum": ["allegrex", "vfpu", "guest-memory", "scheduler", "interrupts", "callbacks", "generic-hle", "ge-display", "audio", "io", "backend-contracts", "evidence"]}
        },
        "unknown_capability_policy": {"const": "fail-closed"},
        "boot": {
          "type": "object", "additionalProperties": false,
          "required": ["entry_policy", "thread_policy", "arguments"],
          "properties": {
            "entry_policy": {"enum": ["image-entry", "manifest-entry"]},
            "thread_policy": {"enum": ["profile-default", "no-main-thread"]},
            "arguments": {"type": "array", "maxItems": 16, "items": {"type": "string", "maxLength": 128}}
          }
        },
        "resources": {
          "type": "object", "additionalProperties": false,
          "required": ["mode", "locators"],
          "properties": {
            "mode": {"enum": ["none", "manifest-filesystem"]},
            "locators": {"type": "array", "maxItems": 32, "items": {"$ref": "#/$defs/relativePath"}}
          }
        },
        "hle_overrides": {
          "type": "array", "maxItems": 32,
          "items": {
            "type": "object", "additionalProperties": false,
            "required": ["capability", "disposition", "reason", "evidence_class"],
            "properties": {
              "capability": {"$ref": "#/$defs/identifier"},
              "disposition": {"enum": ["core", "explicit-override", "unavailable"]},
              "reason": {"type": "string", "minLength": 1, "maxLength": 512},
              "evidence_class": {"enum": ["PSP_HARDWARE", "PRODUCTION_DISPATCH", "PRODUCTION_HELPER", "MODEL_REFERENCE", "HOST_DIFFERENTIAL", "SOURCE_SHAPE", "PRIVATE_TITLE_ACCEPTANCE"]}
            }
          }
        },
        "input_mapping": {
          "type": "object", "additionalProperties": false,
          "required": ["labels", "replay"],
          "properties": {
            "labels": {"type": "array", "maxItems": 32, "uniqueItems": true, "items": {"$ref": "#/$defs/identifier"}},
            "replay": {"enum": ["none", "deterministic"]}
          }
        },
        "enhancements": {
          "type": "object", "additionalProperties": false,
          "required": ["enabled_by_default", "capabilities"],
          "properties": {
            "enabled_by_default": {"type": "boolean"},
            "capabilities": {"type": "array", "maxItems": 16, "uniqueItems": true, "items": {"$ref": "#/$defs/identifier"}}
          }
        },
        "evidence_profile": {"$ref": "#/$defs/identifier"}
      }
    },
    "guestAddress": {
      "type": "integer",
      "minimum": 4,
      "maximum": 4294967292,
      "multipleOf": 4
    },
    "coreReservedDispatchTarget": {
      "$comment": "Targets matching SR_DISPATCH_VFPU_TAG under SR_DISPATCH_VFPU_MASK (src/rt/recomp.h). dispatch() consumes these as VFPU instruction addresses before any title binding is consulted, so a binding that matched on one could never fire.",
      "type": "integer",
      "minimum": 1073741824,
      "maximum": 1140850687
    },
    "dispatchAlias": {
      "type": "object",
      "additionalProperties": false,
      "required": ["from", "to"],
      "properties": {
        "from": {
          "allOf": [
            {"$ref": "#/$defs/guestAddress"},
            {"not": {"$ref": "#/$defs/coreReservedDispatchTarget"}}
          ]
        },
        "to": {"$ref": "#/$defs/guestAddress"}
      }
    },
    "callbackTerminator": {
      "type": "object",
      "additionalProperties": false,
      "required": ["sentinel"],
      "minProperties": 2,
      "properties": {
        "sentinel": {
          "allOf": [
            {"type": "integer", "minimum": 1, "maximum": 4294967295},
            {"not": {"$ref": "#/$defs/coreReservedDispatchTarget"}}
          ]
        },
        "pc": {"$ref": "#/$defs/guestAddress"},
        "ra": {"$ref": "#/$defs/guestAddress"}
      },
      "anyOf": [{"required": ["pc"]}, {"required": ["ra"]}]
    },
    "runtimeBindings": {
      "type": "object",
      "additionalProperties": false,
      "minProperties": 2,
      "required": ["schema_version"],
      "properties": {
        "schema_version": {"const": 1},
        "fallback_entry": {"$ref": "#/$defs/guestAddress"},
        "worker_thread_entry": {"$ref": "#/$defs/guestAddress"},
        "launcher_thread_entry": {"$ref": "#/$defs/guestAddress"},
        "expected_data_file_count": {
          "type": "integer",
          "minimum": 1,
          "maximum": 1000000
        },
        "dispatch_aliases": {
          "type": "array", "minItems": 1, "maxItems": 32,
          "items": {"$ref": "#/$defs/dispatchAlias"}
        },
        "callback_terminators": {
          "type": "array", "minItems": 1, "maxItems": 32,
          "items": {"$ref": "#/$defs/callbackTerminator"}
        }
      }
    },
    "profileZero": {
      "type": "object", "additionalProperties": false,
      "required": ["schema_version", "runnable", "source_program", "build", "acceptance"],
      "properties": {
        "schema_version": {"const": 1},
        "runnable": {"type": "boolean"},
        "source_program": {
          "type": "object", "additionalProperties": false,
          "required": ["source_files", "entry_symbol", "ownership"],
          "properties": {
            "source_files": {"type": "array", "minItems": 1, "maxItems": 16, "uniqueItems": true, "items": {"$ref": "#/$defs/relativePath"}},
            "entry_symbol": {"type": "string", "minLength": 1, "maxLength": 128, "pattern": "^[A-Za-z_][A-Za-z0-9_]*$"},
            "ownership": {"const": "project-authored-public"}
          }
        },
        "build": {
          "type": "object", "additionalProperties": false,
          "required": ["makefile", "working_directory", "target", "toolchain"],
          "properties": {
            "makefile": {"$ref": "#/$defs/relativePath"},
            "working_directory": {"$ref": "#/$defs/relativePath"},
            "target": {"type": "string", "minLength": 1, "maxLength": 64, "pattern": "^[A-Za-z0-9][A-Za-z0-9._-]{0,63}$"},
            "toolchain": {"type": "string", "minLength": 1, "maxLength": 128, "pattern": "^(?!/)(?!.*\\\\)(?!.*:).+$"}
          }
        },
        "acceptance": {
          "type": "object", "additionalProperties": false,
          "required": ["schema_version", "status", "private_inputs_allowed", "cases"],
          "properties": {
            "schema_version": {"const": 1},
            "status": {"enum": ["scaffold", "ready", "blocked"]},
            "private_inputs_allowed": {"const": false},
            "cases": {
              "type": "array", "minItems": 1, "maxItems": 32,
              "items": {
                "type": "object", "additionalProperties": false,
                "required": ["id", "status", "evidence_class", "assertion"],
                "allOf": [
                  {
                    "if": {
                      "properties": {"status": {"const": "implemented"}},
                      "required": ["status"]
                    },
                    "then": {"required": ["gate"]}
                  }
                ],
                "properties": {
                  "id": {"$ref": "#/$defs/identifier"},
                  "status": {"enum": ["planned", "implemented", "blocked"]},
                  "evidence_class": {"enum": ["PSP_HARDWARE", "PRODUCTION_DISPATCH", "PRODUCTION_HELPER", "MODEL_REFERENCE", "HOST_DIFFERENTIAL", "SOURCE_SHAPE"]},
                  "assertion": {"type": "string", "minLength": 1, "maxLength": 512},
                  "gate": {"$ref": "#/$defs/identifier"}
                }
              }
            }
          }
        }
      }
    }
  }
}
