{
  "schema_version": 1,
  "id": "pspdev-phase5-v1",
  "display_name": "Nakagawa Test Program",
  "kind": "synthetic",
  "executable": {
    "base": 142622720,
    "entry": 142622720,
    "bss_metadata_source": "elf",
    "extra_executable_spans": []
  },
  "modules": [],
  "filesystem": {
    "data_root": "fixtures/pspdev_phase5",
    "memory_stick_root": "build/pspdev_phase5/memstick",
    "device_prefixes": ["host0:", "ms0:"]
  },
  "hle_profile": "synthetic-minimal",
  "codegen_profile": "none",
  "feature_requirements": ["allegrex-core", "host-filesystem", "psp-hle"],
  "verification_profile": "synthetic-public",
  "runtime_bindings": {
    "schema_version": 1,
    "fallback_entry": 142622976,
    "worker_thread_entry": 142623232,
    "launcher_thread_entry": 142623488,
    "dispatch_aliases": [
      {"from": 142627072, "to": 142627328}
    ],
    "callback_terminators": [
      {"sentinel": 4294967295, "pc": 142627840, "ra": 142628096}
    ]
  },
  "notes": "Source-owned PSPDEV/PSPSDK compiled Phase 5 fixture (fixtures/pspdev_phase5). Deliberately configured differently from synthetic-allegrex-v1: the canonical PSP user-module load base 0x08804000 instead of the user-memory region start, no guest PRX of any kind, and an HLE-dependent feature set. No retail bytes or derived metadata."
}
