{
  "schema_version": 1,
  "id": "synthetic-title2-v1",
  "display_name": "Nakagawa Synthetic Title 2 Fixture",
  "kind": "synthetic",
  "game_name": "synthetic_title2",
  "executable": {
    "base": 150994944,
    "entry": 150995180,
    "bss_metadata_source": "elf",
    "extra_executable_spans": []
  },
  "modules": [
    {
      "name": "synthetic2.prx",
      "load_address": 155189248,
      "required": false,
      "role": "optional-guest-prx"
    }
  ],
  "filesystem": {
    "data_root": "fixtures/profile_zero",
    "memory_stick_root": "build/synthetic_title2/memstick",
    "device_prefixes": [
      "host0:",
      "ms0:"
    ]
  },
  "hle_profile": "synthetic-minimal",
  "codegen_profile": "none",
  "feature_requirements": [
    "allegrex-core",
    "host-filesystem"
  ],
  "verification_profile": "synthetic-public",
  "runtime_bindings": {
    "schema_version": 1,
    "fallback_entry": 150995180,
    "worker_thread_entry": 151003136,
    "launcher_thread_entry": 151007232,
    "dispatch_aliases": [
      {
        "from": 151126016,
        "to": 151134208
      },
      {
        "from": 151130112,
        "to": 151138304
      }
    ],
    "callback_terminators": [
      {
        "sentinel": 4294967295,
        "pc": 151195648,
        "ra": 151199744
      }
    ]
  },
  "runtime_contract": {
    "schema_version": 1,
    "core_contract": "psp-core-v1",
    "profile_id": "profile-zero-v1",
    "capability_requirements": [
      "allegrex",
      "audio",
      "backend-contracts",
      "evidence",
      "generic-hle",
      "ge-display",
      "guest-memory",
      "io",
      "scheduler",
      "vfpu"
    ],
    "unknown_capability_policy": "fail-closed",
    "boot": {
      "entry_policy": "image-entry",
      "thread_policy": "profile-default",
      "arguments": []
    },
    "resources": {
      "mode": "manifest-filesystem",
      "locators": [
        "fixtures/profile_zero"
      ]
    },
    "hle_overrides": [],
    "input_mapping": {
      "labels": [
        "analog",
        "circle",
        "cross",
        "start"
      ],
      "replay": "deterministic"
    },
    "enhancements": {
      "enabled_by_default": false,
      "capabilities": []
    },
    "evidence_profile": "profile-zero-public"
  },
  "profile_zero": {
    "schema_version": 1,
    "runnable": true,
    "source_program": {
        "source_files": [
          "fixtures/profile_zero/main.c"
        ],
      "entry_symbol": "main",
      "ownership": "project-authored-public"
    },
    "build": {
      "makefile": "fixtures/profile_zero/Makefile",
      "working_directory": "fixtures/profile_zero",
      "target": "EBOOT.PBP",
      "toolchain": "PSPDEV/PSPSDK (locally installed)"
    },
    "acceptance": {
      "schema_version": 1,
      "status": "ready",
      "private_inputs_allowed": false,
      "cases": [
        {
          "id": "program-image",
          "status": "implemented",
          "gate": "profile-zero-e2e",
          "evidence_class": "SOURCE_SHAPE",
          "assertion": "The PSPDEV-built source fixture loads as a ProgramImage whose entry matches the manifest and lies in a checked executable span."
        },
        {
          "id": "aot-generation",
          "status": "implemented",
          "gate": "profile-zero-e2e",
          "evidence_class": "SOURCE_SHAPE",
          "assertion": "The public source program is accepted by the existing analyzer and AOT generator without selecting an HST profile."
        },
        {
          "id": "runtime-dispatch",
          "status": "implemented",
          "gate": "profile-zero-e2e",
          "evidence_class": "PRODUCTION_DISPATCH",
          "assertion": "The profile-zero entry executes through the production runtime and exits with an asserted return state."
        },
        {
          "id": "scheduler-vblank-input",
          "status": "implemented",
          "gate": "profile-zero-e2e",
          "evidence_class": "PRODUCTION_DISPATCH",
          "assertion": "A public route asserts one thread, deterministic VBLANK progression, and a controller sample without private title state."
        },
        {
          "id": "ge-presentation",
          "status": "implemented",
          "gate": "profile-zero-e2e",
          "evidence_class": "PRODUCTION_DISPATCH",
          "assertion": "A source-owned clear and primitive reach the backend and presentation seam with a truthful public capture result."
        },
        {
          "id": "audio-helper",
          "status": "implemented",
          "gate": "profile-zero-e2e",
          "evidence_class": "PRODUCTION_HELPER",
          "assertion": "A source-owned audio sample reaches the selected public audio capability or fails closed as unavailable."
        },
        {
          "id": "savedata-roundtrip",
          "status": "implemented",
          "gate": "profile-zero-e2e",
          "evidence_class": "PRODUCTION_DISPATCH",
          "assertion": "A source-owned save operation is confined to the declared writable root and its bytes round-trip deterministically."
        }
      ]
    }
  },
  "notes": "Synthetic Title 2 uses the source-owned profile-zero PSPDEV fixture at a distinct 0x090xxxxx address family. profile-zero-e2e validates its production route without private inputs; no retail bytes or private inputs."
}
