{
  "schema_version": 1,
  "id": "showcase-scene-v1",
  "display_name": "Nakagawa 3D Showcase",
  "kind": "synthetic",
  "executable": {
    "base": 142622720,
    "entry": 142622956,
    "bss_metadata_source": "elf",
    "extra_executable_spans": []
  },
  "modules": [],
  "filesystem": {
    "data_root": "",
    "memory_stick_root": "build/showcase/memstick/TEST00007",
    "device_prefixes": ["host0:", "ms0:"]
  },
  "hle_profile": "synthetic-minimal",
  "codegen_profile": "none",
  "feature_requirements": ["allegrex-core", "host-filesystem", "psp-hle"],
  "verification_profile": "synthetic-public",
  "runtime_contract": {
    "schema_version": 1,
    "core_contract": "psp-core-v1",
    "profile_id": "profile-zero-v1",
    "capability_requirements": [
      "allegrex", "audio", "backend-contracts", "evidence", "generic-hle",
      "ge-display", "guest-memory", "io", "scheduler", "vfpu"
    ],
    "unknown_capability_policy": "fail-closed",
    "boot": {"entry_policy": "image-entry", "thread_policy": "profile-default", "arguments": []},
    "resources": {"mode": "none", "locators": []},
    "hle_overrides": [],
    "input_mapping": {"labels": ["analog", "cross", "start"], "replay": "deterministic"},
    "enhancements": {"enabled_by_default": false, "capabilities": []},
    "evidence_profile": "profile-zero-public"
  },
  "profile_zero": {
    "schema_version": 1,
    "runnable": false,
    "source_program": {
      "source_files": ["fixtures/showcase/ge_scene/main.c", "fixtures/showcase/common/tone.h"],
      "entry_symbol": "main",
      "ownership": "project-authored-public"
    },
    "build": {
      "makefile": "fixtures/showcase/Makefile",
      "working_directory": "fixtures/showcase",
      "target": "showcase_scene_app.prx",
      "toolchain": "PSPDEV/PSPSDK (locally installed)"
    },
    "acceptance": {
      "schema_version": 1,
      "status": "scaffold",
      "private_inputs_allowed": false,
      "cases": [
        {
          "id": "ge-input-audio",
          "status": "planned",
          "evidence_class": "PRODUCTION_DISPATCH",
          "assertion": "The packaged scene renders rotating textured geometry, samples analog and button input, and submits a source-generated tone through sceAudio."
        },
        {
          "id": "production-window",
          "status": "planned",
          "evidence_class": "PRODUCTION_DISPATCH",
          "assertion": "The package starts from the native player's Play action and presents its first frame in a window."
        }
      ]
    }
  },
  "notes": "Source-owned PSPSDK scene fixture. TEST00007 is synthetic identity only; no retail title identity or bytes are used. Runtime acceptance remains profile-zero scaffold until the public evidence matrix is complete."
}
