{
  "schema_version": 1,
  "id": "display-smoke-v1",
  "display_name": "Nakagawa Display Smoke Fixture",
  "kind": "synthetic",
  "executable": {
    "base": 142671872,
    "entry": 142671872,
    "bss_metadata_source": "elf",
    "extra_executable_spans": []
  },
  "modules": [],
  "filesystem": {
    "data_root": "fixtures/display_smoke",
    "memory_stick_root": "build/display-smoke-v1/memstick",
    "device_prefixes": ["host0:", "ms0:"]
  },
  "hle_profile": "synthetic-minimal",
  "codegen_profile": "none",
  "feature_requirements": ["allegrex-core", "psp-hle"],
  "verification_profile": "synthetic-public",
  "notes": "Source-owned display/presentation fixture generated by fixtures/display_smoke/generate.py. The guest fills the PSP framebuffer and flips it through sceDisplaySetFrameBuf once per frame, so it is the first public-scope title that exercises the presentation path end to end and the first the native player can launch. Its build directory and artifact stem are deliberately this manifest's id, because src/core/nk_launch.c resolves a launch by probing build/<title_id>/<title_id>.exe. Hand-assembled MIPS from a committed recipe: no PSPDEV toolchain, no retail bytes, no derived metadata."
}
